{
  "$schema": "https://json-schema.org/draft/2020-12/schema",
  "$id": "https://config.bluefoxconsultant.com/schema.v1.json",
  "title": "Blue Fox OS tenant config",
  "description": "JSON consommé par le welcome agent au premier démarrage et par le pipeline BlueBuild pour le branding par tenant.",
  "type": "object",
  "required": [
    "slug",
    "version",
    "image_ref",
    "services",
    "branding"
  ],
  "properties": {
    "slug": {
      "type": "string",
      "pattern": "^[a-z0-9][a-z0-9-]{1,30}$",
      "description": "Identifiant tenant, ex: 'bf', 'charles-groleau'."
    },
    "version": {
      "type": "string",
      "const": "v1",
      "description": "Version du schéma. v1 = schéma initial juillet 2026."
    },
    "image_ref": {
      "type": "string",
      "description": "Image OCI bootable, ex: ghcr.io/bluefoxconsultant/blue-fox-os-bf:latest."
    },
    "services": {
      "type": "object",
      "required": [
        "nextcloud",
        "authentik",
        "imap"
      ],
      "properties": {
        "nextcloud": {
          "type": "object",
          "required": [
            "url"
          ],
          "properties": {
            "url": {
              "type": "string",
              "format": "uri"
            },
            "talk_enabled": {
              "type": "boolean",
              "default": true
            },
            "oidc_client_id": {
              "type": "string",
              "description": "client_id du fournisseur Nextcloud dans Authentik. Sert d'audience a l'echange de jetons RFC 8693 qui obtient un mot de passe d'application en arriere-plan, sans redemander de SSO au premier demarrage. Absent = l'agent d'accueil retombe sur le parcours navigateur. Ce n'est pas un secret ; le fournisseur CIBLE doit par ailleurs declarer federer avec blue-fox-os cote Authentik."
            }
          }
        },
        "odoo": {
          "type": "object",
          "properties": {
            "url": {
              "type": "string",
              "format": "uri"
            }
          }
        },
        "vaultwarden": {
          "type": "object",
          "properties": {
            "url": {
              "type": "string",
              "format": "uri"
            }
          }
        },
        "authentik": {
          "type": "object",
          "required": [
            "url",
            "issuer"
          ],
          "properties": {
            "url": {
              "type": "string",
              "format": "uri"
            },
            "issuer": {
              "type": "string",
              "format": "uri"
            },
            "client_id": {
              "type": "string"
            }
          }
        },
        "imap": {
          "type": "object",
          "required": [
            "host",
            "port"
          ],
          "properties": {
            "host": {
              "type": "string"
            },
            "port": {
              "type": "integer",
              "minimum": 1,
              "maximum": 65535
            },
            "use_tls": {
              "type": "boolean",
              "default": true
            }
          }
        },
        "smtp": {
          "type": "object",
          "properties": {
            "host": {
              "type": "string"
            },
            "port": {
              "type": "integer"
            },
            "use_tls": {
              "type": "boolean",
              "default": true
            }
          }
        },
        "talk": {
          "type": "object",
          "properties": {
            "url": {
              "type": "string",
              "format": "uri"
            }
          }
        },
        "calcom": {
          "type": "object",
          "properties": {
            "url": {
              "type": "string",
              "format": "uri"
            }
          }
        }
      }
    },
    "branding": {
      "type": "object",
      "required": [
        "logo_url",
        "wallpaper_url"
      ],
      "description": "Champs optionnels (palette, system_font, plasma_theme, sddm_theme) tombent sur les defaults BF canoniques (#29ABE1 / #2D3031 / Lexend) si absents — voir scripts/generate_kde_theme.py.",
      "properties": {
        "logo_url": {
          "type": "string",
          "format": "uri",
          "description": "PNG transparent, idéalement 1024x1024."
        },
        "wallpaper_url": {
          "type": "string",
          "format": "uri",
          "description": "JPG ou PNG 1920x1080 minimum."
        },
        "splash_url": {
          "type": "string",
          "format": "uri",
          "description": "Splash Plymouth, optionnel."
        },
        "palette": {
          "type": "object",
          "description": "Hex couleurs. Defaults BF si non fourni : primary #29ABE1, secondary #2D3031, accent = primary.",
          "properties": {
            "primary": {
              "type": "string",
              "pattern": "^#[0-9A-Fa-f]{6}$",
              "default": "#29ABE1"
            },
            "secondary": {
              "type": "string",
              "pattern": "^#[0-9A-Fa-f]{6}$",
              "default": "#2D3031"
            },
            "accent": {
              "type": "string",
              "pattern": "^#[0-9A-Fa-f]{6}$"
            }
          }
        },
        "system_font": {
          "type": "string",
          "default": "Lexend",
          "description": "Police système. Defaut Lexend (BF). Doit être disponible dans l'image."
        },
        "boot_bg_color": {
          "type": "string",
          "pattern": "^#[0-9A-Fa-f]{6}$",
          "description": "Couleur du fond plein écran Plymouth (boot splash). Defaut: palette.secondary. BF utilise #001533 (navy)."
        },
        "app_icon_url": {
          "type": "string",
          "format": "uri",
          "description": "Icône application menu / neofetch. Idealement SVG pour scaling. Defaut: logo_url."
        },
        "plasma_theme": {
          "type": "string",
          "description": "Nom du look-and-feel package KDE. Defaut: dérivé du slug (ex: 'bf')."
        },
        "sddm_theme": {
          "type": "string",
          "description": "Nom du theme SDDM. Defaut: dérivé du slug (ex: 'bf')."
        }
      }
    },
    "bookmarks": {
      "type": "array",
      "items": {
        "type": "object",
        "required": [
          "title",
          "url"
        ],
        "properties": {
          "title": {
            "type": "string"
          },
          "url": {
            "type": "string",
            "format": "uri"
          },
          "pinned": {
            "type": "boolean",
            "default": false
          }
        }
      }
    },
    "fetched_at": {
      "type": "string",
      "format": "date-time",
      "description": "Set par le welcome agent au moment de la fetch."
    }
  }
}
